	<!ELEMENT domicilio (calle, numero, piso, letra, ciudad, provincia, escalera)>
	<!ELEMENT calle (#PCDATA)>
	<!ELEMENT numero (#PCDATA)>
	<!ELEMENT piso (#PCDATA)>
	<!ELEMENT letra (#PCDATA)>
	<!ELEMENT ciudad (#PCDATA)>
	<!ELEMENT provincia (#PCDATA)>
	<!ELEMENT escalera EMPTY>