<?xml version="1.0" encoding="UTF-8"?>

<!DOCTYPE domicilio SYSTEM "Ejemplo_clase_Externo_2.dtd">

<domicilio>
	<calle>Paz</calle>
	<numero>54</numero>
	<piso>1Âª</piso>
	<letra>A</letra>
	<ciudad>Manzanares</ciudad>
	<provincia>C.Real</provincia>
	<escalera/>
</domicilio>